,chi_sim,eng,file,fra,spa
0,河 restorbganie     DIETARY SUPPLEMENT 180 VEGETARIAN CAPSULE>,£  restorégan®     DIETARY SUPPLEMENT 180 VEGETARIAN CAPSULE®,images/Enzy-Restore.jpg,$  restoréganie     DIETARY SUPPLEMENT 180 VEGETARIAN CAPSULE*,£  restoregan     DIETARY SUPPLEMENT — 180 VEGETARIAN CAPSULES
1,from Texa5 Tfees Weeds & Gras565  一 一 HoMEoWIMIC 州 l Season l′_I髓= =`,"from Texas Trees, Weeds & Grasses  ~—— HOMEOPATHIC == All Season Relief:",images/96. 002145708.jpg,"from Texas Trees, Weeds & Grasses  — HOMEOPATHIC — AIl Season Relief: —","from Texas Trees, Weeds % Grasses —  — HOMEOPATHIC — All Season Relief: -"
2,l 去 妻目 痕  GMP LnoloacnhoLosm  一  〇 MINIX  0PHTHALMOLOGY DROPS F0g006S N cAfS  INDICATIONS  D ketts (Leofoac HCL05 D conoetntis  D Sweli  D ppron  D Bleid ntammaton o N X 日 amoooss MINI  MmAmoLoey DWK,| —  OPHTHALMOLOGY DROPS FOR DOGS AND CATS  INDICATIONS  O Keratitis (Levofioxacin HCL 0.5 *> O Conjunctivitis  O Swelling  O Epiphora  O Eyelid Inflammation 0 N X  5 omitaimorross MNI  OPHTHALMOLOGY DROP,images/TB1fWrVJVXXXXaOXXXXXXXXXXXX_!!2-item_pic.jpg,p  OPHTHALMOLOGY DROPS FOR DOGS AND CATS  INDICATIONS  D Keratitis (Levofloxacin HCL 0 5 *> O Conjunctivitis  O Swelling  © Epiphora  © Eyelid Inflammation ° N X  © Opiaimorrosis MNI  OPHTHALMOLOGY DROFS,——]]  OPHTHALMOLOGY DROPS FOR DOGS AND CATS  INDICATIONS  'O Keratitis (Levofloxacin HCL 05 *> O Conjunctivitis  ' Swellng  l Epiphora  'l Eyelid Inflammation o N X  El Opimalmorross MNI  OPHTHALMOLOGY DROFS
3,infants under t year ofag6.-  Mutrition Facts b,infants under 1 year of age.  wﬁtionb Facts Sevings bar Comtanr 30,images/96. 859112006086_supp.jpg,infants under l year of age.  Ëtﬁtio«_ Facts Senings Per Continer 0,infants under 1 year of age. -  !¿=iñtion_ Facts SevinosPor Contaner 80
4,Indoor & Outdoor Allergies zn     Z ″ /XAl/A/ 者 AE/A3/7  CWe7toKeiibJreCteH5EpD7UDTOCfS0TEJ 夥,Indoor & Outdoor Allergies Nl     2 0 LRI  “When taken asulirected SeeDrug Facts Panel. ;,images/94. 041100806574.jpg,Indoor & Outdoor Allergies z ané -     2 a CHEWABLE JABLETS:  d MEh és és addaa Vetlpéelots deilah '(,"Indoor 8 Outdoor Allergies ZA     2 0 2001197177  M lze 2a ei ae A """
5,loratadine tablets L 朋 L,"loratadine tablets USP, 10 mg",images/00011822316453_1.jpg,"loratadine tablets USP, 10 mg",loratadine tablets U oo
6,L ingredient in laritin “  berkley  ISESSL        MORE  GUARANTEE  ' ( …_ 口 `,"Compare to the active [ TE T T  berkley  jensen.        MORE  V2L H S  E B,S@ l",images/97. 5803756e-9efd-5cd3-819a-c1315b82a944.jpg,"Compare to the active TON E RE L b  e SMS)  IZaSSar        MO  GUARANTEE  E | B,S® \","(N OCE al C1 O NOE icl  SY  aS        MORE  GUARANTEE  “ B,$© !"
7,E  ALLERGY  Diphenhydramine HCI 25mg | Antihistamine           c u 园 o'tchyThr。at *辈n』亨彗h仓荨集彗s actual size 24 TABLETS  吴 吴 吴 吴 吴 吴 吴 吴 吴 吴 吴 吴 吴 吴 吴 吴 吴 吴 吴 吴 吴 吴 吴 吴 吴 吴 吴,"ALLERGY  Diphenhydramine HCI 25mg | Antihistamine           T I - T A [T @ ltchy, Watery Eyes < ltchy Throat *!‘rlnlzn.lrghlAerﬁgs R N 24 TABLETS  e",images/00312547170314.jpg,"ALLERGY  Diphenhydramine HCI 25mg | Antihistamine           ©Sneezing T deT © ltchy, Watery Eyes D |s AI de ZEN *EnäÏlﬁhl&!äzÊs ÉTACE UN 24 TABLETS  M E E","ALLERGY  Diphenhydramine HCI 25mg | Antihistamine           O Sneezing — INAC ) Itchy, Watery Eyes Se ACE *ynlz:l.rghlAta!ºz?s EMUE NN 24 TAB|.ETS  S"
8,NDC 50114-6165-2 c  Zeel  `_`_-_._ Arthritis Pain Relief For the temporary relief of:  Minor Joint Pain and Stiffness  Homeopathic Medicine  100 Tablets 2 H e,NDC 50114-6165-2 —  Zeel  ‘ﬁ Arthritis Pain Relief  For the temporary relief of:  Minor Joint Pain and Stiffness  Homeopathic Medicine  100 Tablets Hee,images/zeel_1024x1024.jpg,NDC 50114-6165-2 —  Zeel  ‘_ Arthritis Pain Relief  For the temporary relief of:  Minor Joint Pain and Stiffness  Homeopathic Medicine  100 Tablets 7 Hee,NDC 50114-6165-2 ——][o[z——l  Zeel  WR Arthritis Pain Relief  For the temporary relief of:  Minor Joint Pain and Stiffness  Homeopathic Medicine  100 Tablets _ Hee
9,"5  levmetamfetamine 50 .l  1elieffrom nasal t:ongestion due to (:olds,hay fever, allergies            I 讳 h soothing  nentholyapors NET WT 0.007020(","'  levmetamfetamine 50 -I  lief from nasal ongestion due to i:olds, hay fever, allergies       with soothing  renthol vapors NET WT 0.007 0Z(",images/00011822302944.jpg,";  levmetamfetamine 50 —l  lief from nasal ongestion due to (zolds, hay fever, allergies       iwith soothing  rentholvapors … NETWT 0.007 0Z(",",  levmetamfetamine 50 —I  lief from nasal ongestion due to olds, hay fever, allergies       with soothing  nentholvapors — NETWT 0007070"
10,r “S_03  W  人 一 友  尸 B,pharmacy tcompare to the active ingredient       §'\ % in pramamine® Tablets  S -  N  =~ E  *%x a  N o  = 7  = o  = ¢  X DIMENHYDRINATE TABLETS/A  sickness relief 36 ————,images/449014_1280x720.jpg,pharmacy tCompare tothe active ingredient       \5 % in Dramamine* Tablets  s :  :SE;  = © P> .  *È:; “  V 9  S3: Û  S D  = *  SZ DIMENHYDRINATE TABLETS/ À  sickness relief 6 ——,"pharmacy +compare to the active ingredient       $ % in pramamine* Tablets  -  ,.  — - = a  *%:; u  II< o  ! q  — D  == +  X DIMENHYDRINATE TABLETS/A  sickness relief 38 — —"
11,玲  1 NDC 63654-526-69  U        Lorotodfye A//e′′gy  “ b/ets U5P 10 mg  FJrrAzRSJE7  F 7 印 077 d L L 招 _10L2ZZ3  Re/ief of: Sneezing; Runny Noser /tchy: Watery Eyes「 /tchy Throat or Nose-,"==  N NDC 63654-526-69        Loratadine A I I er g y  Tablets USP, 10 mg  24]HourAllergylRelief;  Indoor & Outdoor Allergies ) (1) rablets &  Relief of: Sneezing; Runny Nose; Itchy, Watery Eyes, ltchy Throat or Nose.",images/900 (3).jpg,"N3  W NDC 63654-526-69        Loratadine A I I er g y  Tablets USP. 10 mg  20 0m lMar 7 Ll  Indoor & Outdoor Allergies JORTIEF  Relief of: Sneezing; Runny Nose; ltchy, Watery Eyes, ltchy Throat or Nose.","Ne  N NDC 63654-526-69        Loratadine A I I er g y  Tablets USP, 10 mg  24/HourAllergy/Relief  MN AM 10£  Relief of: Sneezing; Runny Nose; Itchy, Watery Eyes, Itchy Throat or Nose."
12,heceseomea  L  Muscle pan&Stfess Swelingfrom niuries Bnising  ArniCar亨履 Ge  \ QvihJerle  e eroney en e,NDC 022090005  Muscle Pain & Stiffness     Arnicar$“ Ge  Cuickly Absorbd     rks Naturally. wilh Your Body,images/gallery-1494812328-arnicare-muscle-relief-rub-gel.jpg,NOC 0220-0000.59  Muscle Pain & Stiffness     Arnicarÿ Ge  Quickly Absorbed     rks Naturally wth Your Body,INDC 0220-0000-59  Muscle Pain £ Stiffness     Arnicar9“ Ge  Quicdy Absorbed     rks Naturally wilh Your Body
13,"sinus relief  nasal spray  nasaldecongestant     fast, powerful 一 congestion relief  “relieves painful sinus pressure  forcolds & allergies ′ 1FL0Z (30 mU)","B ==  ® PHARMACY  sinus relief  nasal spray  nasal decongestant  fast, powerful | congestion relief  | relieves painful sinus pressure  | for colds & allergies  1FLOZ (30 mL)  P",images/00011822145763.jpg,"Hj —  ® II T ETTS7  sinus relief  nasal spray  nasal decongestant  fast, powerful {_congestion relief  |_relieves painful sinus pressure  ( for colds & allergies  1 FL 0Z (30 mL)  «","U ===  o PHARMACY  sinus relief  nasal spray  nasal decongestant  fast, powerful — congestion relief  — relieves painful sinus pressure  | for colds 8 allergies  1FLOZ (30 mL)  e"
14,"w 怀 纳 L zLAXzX 动 x  《 x7A/yAL/ 引 国 events Hotion siokness 更  Chewable ` L 肉 , | _ 人 汀 以 l","U [T ][ Causes Less Drowsiness  DONINE e otn st |  Chewable ‘ J.f_/g:/ .;-A""_J’J/ { Protection",images/176140471808595.jpg,"LUE OIUE SEUIN Lauses Less Drowsiness  DONINE [ts tn itrss À  Chewable ‘ _J./J'J‘_‘/ 4-J'I_J,J/ | Protection","Works 4 Times Longer Causes Less Drowsiness  DBONINE re nn Siiress Y  Chewable 1 JJJ5_; .:-A'¡_J,J/ | Protection"
15,E  L of 吴 SiCkne55  国 DroWsSine55  a P「0teCtiOn With Le55  [ L [ J U  u E  镳 彗 b : M [ : | o 2  LESS 巳 [ Y E 〇 Q 尼 A  E,"wnline  . prevents Up to 24 Hours of VR Ul Drowsiness  . Protection with Less  @ LR yal  Compare to the [l ' ingredient [  LU Drowsy ey  "" : < Y W 4 : N "" 3  LESS D ROws Y FORM  LA",images/spin_prod_ec_800880301.jpg,=  MP L A SS 24 Hours of Motion Sickness D1  A A TIL RES  NDC CO LEU LS  P A A [T L ingredient U  P pc Formula”  À Ë “ : y 3 ‘ = * è  30 V te 14e SE  (O T PS,".  NO 24 Hours of Motion Sickness Del  M o |( 0i( With Less  NDC ENAU  compare to the [eTm ingred¡ent of  e PE [ IC  , 3 N y V E - N 0 ]  N — r Nd  ULA"
16,"rgy Symptoms relief  Relief of w Runny, ltchy Nose W Sneezing  h OUr 奴 Watery, ltchy Eyes w ltchy Skin Rash","2rgy symptoms relief  Relief of + Runny, Itchy Nose s 60 +/ Sneezing . s  h our + Watery, Itchy Eyes + ltchy Skin Rash",images/95. 8887319426163_0102_1502189900528.jpg,">rgy symptoms relief  Relief of «/ Runny, Itchy Nose > 60 « Sneezing . è  h our « Watery, Itchy Eyes </_Itchy Skin Rash","2rgy symptoms relief  Relief of Y Runny, Itchy Nose E 60 Y Sneezing . s  h our Y Watery, Itchy Eyes Y lItchy Skin Rash"
17,元 z 砂  crzeroarery 一 7 M totZTLIEooi2  x a syz  vmomreem cr < aorrariasy  anvzurv d ir -  口 u 口 口 d 孙  g iici aavmmazaymidrarccr ir y ′″″″。=′  razar 又 L ZzimiydzLmurigr A  0 阮 心 3 - 工 - d 二 rgrcP 55 二 CFXErct AdL L 工 LIFEriar           Compare to Tylenole Sinus + Headache active ingredients*  NDC 37808-466-08  Relieves ′ s Headache Paln  GSinus PreSSUIE Nasal CongestI0n ACTUAL SIZE  Instant Cooling Sensation,"| : . . Compare to Tylenol® Sinus + Headache 4 active ingredients® §§§§ NDC 37808-466-08 i\  wimmoary - Sl ok e 27,  s s PIT S S PIANCS MBI RIS poA S ES KT SIBII TSI S I PITII LIRS FAS Y 3.     P £ KL CPIISEP LN TS  i T T EOPS TET TCIIE S FA LI TET T  = Nasal Congestion ACTUAL SIZE  Instant Cooling Sensation  24 CAPLETS",images/96. 000896525.jpg,| \ . N Compare to Tylenol® f d CEOE LS 4 active ingredients* ÊËÎË NDC 37808-466-08 â‘  ocsouprurens z ÉTUIS LI EE L 34  Drensanz s105004 045 SD LAAIANCS ALEFDULISEEII N SO UAN DEF FPOITIGIII SE LD FPAIIIE OL TILEEAAS FOUS SNF     LAILIEL = IL CDISLCTLNL S SS  R 0 EFTOAMNS LI CIS PSAS T 07 IOTNES S MMN HAOFCROAS  « Nasal Congestion ACTUAL SIZE  Instant Cooling Sensation  24 CAPLETS,| x _ N Compare to Tylenol* ST oe u active ingredients* 555% NDC 37808-466-08 $W  — E _ 2  aaIO D1 JO TPNA DI DI 1D AD III DIESID 1O PDIIIDUJIVLLLS ID Z) .     PO p XA INO NMZ  . a D TI AA AA JO77 - FDDIEIA FELIAA FEN  s Nasal Congestion ACTUAL SIZE  Instant Cooling Sensation  24 CAPLETS
18,"NDC 60986-1003-3  ALLERNEST  Homeopathic Combination Medicine 〕  ,Indications: For reliefo norsymptoms due to alegC 1 reactions.  >> NESTMANN <<  169 FI Oz (50 mu",NDC 60986-1003-3  ALLERNEST  Homeopathic Combination Medicine ¥  Indications: For relief of minor symptoms due to allerge reactions.  >>NESTMANN <<  169 FI Oz (50 ml),images/allernest-homeopathic-liquid-small-50-ml-by-marco-pharma.w710.h473.2x.jpg,NDC 60986-1003-3  ALLERNEST  Homeopathic Combination Medicine à  _Indications: For reliet of Minor symptoms due to allerge » reactions.  >> NESTMANN <<  169 FI Oz (50 mL),NDC 60986-1003-3  ALLERNEST  Homeopathic Combination Medicine 3  _Indications: For relief of Minor symptoms due to allerge -+ reactions.  >> NESTMANN <<  169 FI Oz (50 mL)
19,"ActfreHerb“  Be active     HERBAL FORMULA EXTRACT 气  Liu Wei Di Huang Tang 八 味 地 黄 满  for professional use AH301E     5:1 Concentrate Granule 厂_\"" ' 气 NetWt. 100 g (3.53 Oz)","ActlveFerb  Be active     HERBAL FORMULA EXTRACT <  Liu Wei Di Huang Tang e &b  for professional use AH301E  5:1 Concentrate Granule Net Wt. 100 g (3.53 Oz),",images/liuweib.jpg,ActiveHerb”  Be active     HERBAL FORMULA EXTRACT &  Liu Wei Di Huang Tang # 4% #3  for professional use AH301E  5:1 Concentrate Granule Net Wt. 100 g (3.53 Oz),"Actíveherb""  Be active     7 eN U7  Liu Wei Di Huang Tang RRUEL  for professional use AH301E  5:1 Concentrate Granule Net Wt. 100 g (3.53 Oz)"
20,Eaceauuzouneron  E  Fsz 2  s h  EE s 途 河 c y 语 s E 二 招 s  Chemists「Own「  Stomach Ache & Pain Relief  Relief of acute stomach ache andlpain due to cramps and spasmis  2o tab_ets Each tablet contains Hyoscine Butylbromide 10 mg     AUSTR232432,e A i = )  STormach Achie Bc Faan Reet ~ =S AR e =  LT  KEEP OUT OF REACH OF CHILDREN        Stomach Ache & Pain Relief  Relief of acute stomach ache and' pain due to cramps and spasms  ittt St S S S  v e =P e s  20 tablets Each tablet contains Hyoscine Butylbromide 10 mg PV FeP2E),images/9316360117205_co_stomach_ache_pain_relief_20_tabs_-_836007.jpg,L SS e S BI  — à Q e E EE SS a S eN p E E b S  Q EU  KEEP OUT OF REACH OF CHILDREN        Stomach Ache & Pain Relief  Relief of acute stomach ache and pain due to cramps and spasms  p PS SRE SS  P p A  20 ps 1e) =1 RE ce Hyoscine Butylbromide 10 mg VUI RE EU),o ——L]——— — DS  Suomacoan AQae a P aa Relhet “ A =  PHARMACY MEDICINE  O e TNO Tn        Stomach Ache 8 Pain Relief  Relief of acute stomach ache andipain due to cramps and spasms  i DT  aa d O  20 tablets — Each tablet contains Hyoscine Butylbromide 10 mg AUSTR 232432
21,MQ  Pain Relief Patch Fast Relief  /  代 河 b /  醴′_2」叉  ULuS1 逊 3 口 道 L e 沥,MQ  Pain Relief Patch Fast Relief  FAST RELIEF OF MILD TO MODERATE PAIN,images/product-image-230108822.jpg,MQ  Pain Relief Patch Fast Relief  LIN A e AIN e Le A N,MQ  Pain Relief Patch Fast Relief  FAST RELIEF OF MILD TO MODERATE PAIN
22,240 Tablets  Meclizine Hci  Bonamine 25 mg ChewableTabplet              Antiemetic/ Antirvertigo 圃,240 Tablets  Meclizine Hci  Bonamine 25 mg ChewableTablet              Anti-emetic / Anti-vertigo  M,images/bonamine-240-Tabs.jpg,240 Tablets  Meclizine Hc:!  Bonamine 25 mg ChewableTablet              Anti-emetic / Anti-vertigo  w,240 Tablets  Meclizine Hci  Bonamine 25 mg ChewableTablet              Anti-emetic / Anti-vertigo  M
23,"In 自 k_ngb】Q Safe & Natural Oral Spray E Taste-Free, Bio-Energetically Enhancedm, Pure Water Bass     3 NDC# 5795561622 蒯删恽耐 HONEOPATMIC 阮 a  c 伟 E is E J E  深 Pain &Joint 芸 ˇ Relief  a Body Aches un          Stiffjoints             Muscular Sorene$s","TS - kmgblﬂ Safe & Natura| (LT TE gl Taste:Free, Bio-Energerically Enhanced™, Pure Water Base     5 NDC# 5795561622 Wwﬁxm HOMEOPATHIC e o = is i ‘mm sy  =t PQain Sg Joint e Relief.  L Body Aches Ny          Stiff Joints             Muscular Soreness",images/242615-DEFAULT-L.jpg,"ns f kmgblü PSN P PEN P Taste-Free, Bic-Energeticaly Enhanced”"", Pure Water Base     E NDC# 57955-6162-2 WWÊ;‘“ HOMEOPATHIC ur - = is pl ‘…M él  st Pain 83 Joint —n Relief.  e Body Aches t          Stiff Joints             Muscular Soreness","T é kmgle EE NEe [ r Taste-Free, Bio-Energeticaly Enhanced !, Pure Warer Bage!     , NDCE 57955-6162-2 u…""""$¿d HOMEOPATHIC s "" = 1S [ '……  E  s — Pain 85 Joint — Relief.  a Body Aches ..          Stiff Joints             Muscular Soreness"
24,"b 股 jdbirt E bms a jh 血 ssl 月 h 市n rdnal 山 n pour n s t ion u I n ata 地 一 2nants jntmaal ymth r ( nt       weymzluigypgt [maltr 0 ‖'蛐则胍鲫岫 1miisal M 妮 Irages 加 加 冉 5 朱rsg 酝 t ltismttt rt r 皮 虹 irs l u5 (  r 振 吊 agj palt s pn /ibryerts  余 H 皇 仪 ; 伟  _嶂嶂m咖‖懂疃m  动 娆 吻 i 吴 Injional  剧 吴 驿 w 刹 仪  ntatsadgajhe 扬 f 标ned  anb 招 刑 仁  ima snig haa  明 时 Mhtt Ma (44  p y i | p f r [onallt  llplns grsson and/r 吻 nbt 叶 28a Popgrtips 5  Mtalathmgltrmssng        ′ I SPECIALIZED N ERIE9  UP11 c LEE 吴 t  RELAXATION 弘  60 CAPSULES 页 NPN: 80077088 ,  PRODUIT DE SANTE NATUREL NATURAL HEALTH PRODUCT","| ol § ke e tomps et e & sore. Ade & b e cdran e/ou pour i e s s fagtaion ow ma it - & ] semanes. it e e e oz vt e       oz gy nuler i s dat s s sufrez 1 woram e s brevages by gy s corselée. o 4 asomckee fae prewve de  (i éa mard o § ous dever Sipmit by e drge) pest s  o s Mareres.  fnani et s  o e e e 1 ks fo e oy Iradifonally i e 2 sep ad in 1 b of g el et e fn veeks. nialem v e e i peraing heavy  e it sy (o9,  lrem sz Ly ey | oo o vorsen. (ot @  ey | e doressn and/or 168 o i e propertes s  el e e misng,        — g SPECIALIZED N SERIES  OPTI & SLEERIN  VSNl f  60 CAPSULES 0 NPN: 80077088  PRODUIT DE SANTE NATUREL NATURAL HEALTH PRODUCT",images/Opti-Sleep-60-caps-1.jpg,"\ cl h à rédure le temps rrl bc dusommel.Aide à él rr érant el/ou pour rrr (n ls cas d'agtafon où m e rc - e 1 semaines. ès prre e dose avant le       porie rs sgyaret [onsulter  pn dras dl u sivous suFrez  1 rrs e ds breuvages rh é es éconsellée  t d asmmdlrce Farepreuve de  Nn é mèréé, u vous devez pl by e dere) peut se  térain/arpusées/Narquerites.  fn e Fs el sc  d u ec b Éme t takes to rhh eprae cyc Iradifonally dl e d à à Seep @ in t rantar ql ealf pret rr fan D veeks. t bére e e ns F r aera f heavy  uy el es hyersensifrihy (24,  rc ur /Qiy F rs prvst r vorsen. Consult à  r u e deresin and/or d méch f péati prperfes is  Hra fl éragztornissig        | « SPECIALIZED EINJ SERIES  OPTI & S L'EEFRRS  TEVNSINIONN Q  60 CAPSULES ë. NPN: 80077088 .  PRODUIT DE SANTÉ NATUREL NATURAL HEALTH PRODUCT","| nf Ady rdure e temps Ad s d sommel. Ae 4 1bc clnt e/0u pour yoe rur a s cas dagitabon 0u m m yrc lad Y semanes. imital yee e doe avant le       eee al Ce re aa u i u soufrez 1 brego ae des breuvages m e s Mecorsedión v d asmmoere fare preuve de  n d m 0u í oUS devez Mipril by e alre) eut se  re Comprsts Marquerites.  pumt fas el s  M M ei be Eme i tales to d deado yoe Tradifonally ad lral de as aey ad n mitratar y mob led oren b rre an Jueeds. nmbebe e be s rc i oerafing heavy  Ia eeddetess Ayersersibviy (2  lrai Diy family Iay p o vorsen Consult a  al | ae depresion and/or V pc ae propertes s  be ed de r m        | ym SPECIALIZED N SERIES  OPTI 6 SLEEFS  RELAXATION J  60 CAPSULES "" NPN: 80077088 —  PRODUIT DE SANTÉ NATUREL NATURAL HEALTH PRODUCT"
25,Ifyou Smoke your first ci after waking F w,oL ClC Ll St T,images/001488880.jpg,TL LS Nl éN,u smoke P p
26,d . ˇ  SUDAFEDee,"_ -  SUDAFED""*",images/sudf_pe_pressure_pain_cough_ft.jpg,"p 2 —P  SUDAFED""""","1 _ “«  SUDAFED""E"
27,A  zyRTEc 圃  D ALUERGY  D  E,"Childrerns;  ZYRTEC .  [ T35 LY FLLITTI  015 0utd  (‘4m|m of  < sneezing < Runny Nose < ichy, Watery Eyes  hour  Pt",images/0030045020904_0600.jpg,"Children's;  ZYRTEC :  Ctiinne ALLERGY PLV OE EN En OIRs  or/s Outd  (‘4mlm of  ‘ sneering “ Runny Nose “ltchy, Watery Eyes  m  LI",(QEES  ZYRTEC .  (C ALLERGY E T CEE EE  r Outde  (“4m|m of  « sneezing - Runny Nose — tchy; Watery Eyes.  hourd  ECEN
28,EIIIZIIJLINXUJ L i7altilti1f7: 公  x7 二 c72  二 二 一 z  buprofen Tablets 200 m0 怡 4  200 Coated Cap/et5-  E 加  zrraz 一 z C urraze zzprrazozrrrrrcc        卵 卵 :7 利 ZZZ-ST3 7TZTJFXXZ-,P TN e T  Terect>  coorrtir  (TR 200 mg Pain Reliever/ Fever Red Tl  P R  *Capsule—Shaped Tablets     S A P a7y P sy s  LFr iy Pt     ST T BT T T YR T I A T R LT T L R,images/567137a9-58bb-4c9a-a565-88031b099116_2.f3bbdec6c465b121b7f4c2752d8c00a5.jpg,"ETEN E ETE T  7eresetD  Eorrir  Ibuprofen Tablets, PU ON EITe Pn e A f e MRaa (L  200 Coated Caplets*  *Capsule—$haped EU     LOTTAIOUF LITLTTCEUT DO TIL SS  CIS UILT LI LS C     T-R MI E ON S T TT TT","Ea MAl Ea  Te7  o IL  Ibuprofen Tablets, 2NN P Ta AZNO MA  200 Coated Caplets*  *Capsule-$haped Tablets     o AAO A ZAAZA 2  e IICIZ= E     7 M B7 2M M III M"
29,lbuprofen,[o]0To] el {EN,images/ibuprofen-drugs-pain-killer (1).jpg,louprofen,Ibuprofen
30,MAX  Strengthr*  - 一 = 一 、 D0elSym     1 人 c a  NiCHT)TIME,MAX  Strength*  e Delsym’  ey  NIGHT ) TIME,images/Adult_Cough_plus_Nighttime.jpg,"MAX  Strength*  É , Delsym'  ETEN  NIGHT)TIME",MAX  Strength*  = Delsym  _couGH eo  NIGHT) TIME
31,,"'\',,'i“‘l | VAV A0 el B!  Nerve Pain Reliever  l 0.17 1. oz l_\ull\ ,",images/diabetic-nerve-pain-reliever_80931_zoom0.jpg,"'\"",.i""‘| | VAT HL BE!  Nerve Pain Reliever  ‘ 0.17 fl. oz l_‘\|ll‘ |","'¡'¡,.i'-.*| | DUIALDCLI  Nerve Pain Reliever  ' 0.17 . 0z l_*||llx '"
32,Mucus Cough  E  L E  MUCUS FROM YOUR  0 仪  E  uuuL  Each 5mLoforal iquid contains J E,"Mucus Cough  & Cold  © T0 CLEAR BLOCKED (LGN TG el LA (3 . MUCUS FROM YOUR W [T TN N LA (LEN AT 1N [ SR )  200ml  Each 5mL of oral liquid contains Guaiphenesin 100mg, Phenylephrine hydrochloride 5mg",images/558254_xlarge.jpg,"DL RI  dl  « T0 CLEAR BLOCKED OR RUNNY NOSE LS (R ; MUCUS FROM YOUR (I TT SUN LUE S ( VV (RI R GRS  PLn  E A DE A TO ETE Guaiphenesin 100mg, Phenylephrine hydrochloride 5mg","TA  8 Cold  CN7 M TS — TO HELP EXPEL . DI BN P CA (AO  aI  Each 5mL of oral liquid contains Guaiphenesin 100mg, Phenylephrine hydrochloride 5mg"
33,55.23  川 吴 HI,$5.23  DRI,images/95. claritin-5-and-10-ct-9-12-11.jpg,S5.23  OCCIRNHIAUEE 4,$5.23  1DTOOO =
34,"NATURAL HEALTH  Car U菖o宫     yassit with:  '岫""hy薯ye…n酗疃""[ HQarheaft &support  UEEreestain 一  Yhtsin & Zeaxanthin 商 p","Carusos  NATURAL HEALTH     Yayassst with  Ithy eye function ':I:‘""h' health & support Reli  sfeyestrain  \itein g Zeayanthin",images/9323573006066_4.jpg,"Carusos  NATURAL HEALTH     layassit with:  Ithy eye function — Ë‘""'” health & support Reli  D uefére strain —  (tein & Zesxanthin","Carusos  NATURAL HEALTH     Mayassist with:  Mthy eye function - "";:“""'º' health 8: support Reli  —fejestran —  ¿Utein a:Zeaxanthin"
35,a  oWc gooprsso     冒刚颤…_ (>ptimum Relief 家 t Helpsalleiate symptomsassociated 8 Withseasonalallergies:  Sosu s 《 RUY 05e c  a iou            CHEWABLE  TABLETS Homeopathic Medicine,"DIN-HM 80027650  e patiat ingk ) et g o  i Optimum Relief  foEEs Helpsalleviate symptoms associated  E?‘E:‘i: with seasonal allergies : ®gy, © Runny nose Sl e              (LT EEnITn          CHEWABLE  AP Homeopathic Medicine",images/ALLCOMP_Real-relief-100ml-1000x1000_Allergies.jpg,"DIN-HM 80027650  semmerra> patiaé pié cr moseas nc Giaut rn  p Optimum Relief  exs — Helpsalleviate symptoms associated  EË.“;,“,‘; with seasonal allergies : Emiey, — © Runny nose E              TCc 210          CHEWABLE  TABLETS P E","DIN-HM 80027850  e potist a oneecaio nR e Cn eo  o Optimum Relief  ea - Helpsalleviate symptoms associated  E?.“;,“,*; with seasonal allergies : Euew.; — * Runny nose e gnee              wl AMO          CHEWABLE  TABLETS rU aua"
36,"BLACKMORES3, | 『  G ′′耍/′ , 仁 d 《 』","BLACKMORES - —  @ )  ”‘Q_/, : N | j",images/original_CW.jpg,"BLACKMORES — _  @. /  ”‘£{, ; aï j","BLACKMORES — —  a. /  ”'Q_//, L ax J"
37,"Maxinmum 5tength eK0Z。               P Maxnunmsterglh 志 0  amprfIn  5 二 Mens″‖a_F薯i""翼叠‖e_ _ 3′ ypo777Z7  1 nneeoniotenete hn pnongiinneules 20Gplet","Maximum Strength  amprin     P     =  P Maximum Stength 207,  amprin  and Cafeine-Free R sminoghen, Panobon & yrlamine Walate 20 Caplets  E Menstrual Pain Relief C H",images/262838.jpg,"Maximum Strength  amprin     P     =  P Maximum Strength 0Z  amprin  ‘and Cafline-Free M hccusminophen, Pomabrom 6 Pyrlamine Maiete 20 Caplets  Ë Menstrual Pain Relief C —","Maximum Strength  amprin     P     s  P Maximum strength 202  amprin  aand cafteine-Free al ncaminophe, Pamobrom 6 Pyriamine malate 20 Caplets  E Menstrual Pain Relief C —"
38,回 alamy stock photo E,El] alamy stock photo el,images/95. box-of-hayfever-and-allergy-relief-tablets-on-white-background-cca4pt.jpg,E alamy stock photo en,El alamy stock photo —
39,"5oMB  natural pain relieving gel  Net Wt 8 oz, 227.2 9",Foopngs  natural pain relieving gel  NetWt. 8 0z. 227.2g,images/s-l1000.jpg,IsOuBEE  natural pain relieving gel  NetWt.80z. 227.29,Fonmas  hatural pain relieving gel  NetWt.80z. 227.29
40,,Mo Motion Sickness,images/s-l1600.jpg,Ma Motion Sickness,MO Motion Sickness
41,"DRIFIOFF  S00THING SLEEP FORMULAY  山                          FDA  RE61STERED FACILITY     园 LAB  VERIFIED  x  C / ″獠鞭E ‖\E""",DRIFTOFF  SOOTHING SLEEP FORMULA*  60                    FDA  REGISTERED FACILITY  VERIFIED  P o D,images/Driftoff_BadgeImage_2048x.jpg,ULS  SOOTHING SLEEP FORMULA*  |                    FDA  REGISTERED FACILITY  VERIFIED  p a QT,0IO  SOOTHING SLEEP FORMULA*  uN                    FDA  REGISTERED FACILITY  VERIFIED  7 o »
42,THE TMLJ PILL  NATURAL TMJ RELIEF  E,THE TMJ PILL  NATURAL TMJ RELIEF,images/cf7a1438ff6ae4da927edd8cf52fc05cfffade59.jpg,THE TMJ PILL  NATURAL TMJ RELIEF,THE TMJ PILL  NATURAL TMJ RELIEF
43,Cieorhlergyles 园        fDACDWRPemihe 24szol4 20M4toDecenterai zoi4  DomoduionAugusn       E E Ste p D b E c  E,"Clear Allergies e        Per DOH-FDA CDRR Permit No. 26: August 18, 2014 to December 31,2014     014  Promo duration     &  Contact Us Y ETs Torms & Condition's Privacy Policy 2013 WSD Philippin . P  (L R e",images/96. large_608089_doeqeoxr49hzjvzeabn363t9_.jpg,"Clear Allergies C e        Per DOH-FDA CDRR Permit No. 26: August 18, 2014 to December 31,2014     014  Promo duration     G  SS L site Map Terms & Conditions Privacy Policy PE ; PE T  If symptoms persist, consult your doctor,","Clear Allergies O ecimer        Per DOH-FDA CDRR Permit No. 26: August 18, 2014 to December 31, 2014     014  Promo duration     a  OCE Glossary Site Map O A D le a ee ea dA  E de 8 Ea"
